{
  "format": "otserver-scan",
  "schemaVersion": 2,
  "scanner": { "name": "OTserver Otter", "version": "0.4.0" },
  "scan": {
    "id": "8f3f4ac2-3a2d-4e58-a7e6-2a8baf9319b1",
    "startedAt": "2026-10-13T09:00:00Z",
    "finishedAt": "2026-10-13T09:01:00Z",
    "targets": ["192.0.2.0/24"],
    "interface": {
      "id": "test-interface",
      "name": "Test adapter",
      "macAddress": "02:10:00:00:FF:01",
      "addresses": ["192.0.2.254/24"],
      "ipRoutePolicy": "operating-system"
    }
  },
  "devices": [
    {
      "macAddress": "02:10:00:00:00:01",
      "macAddresses": ["02:10:00:00:00:01"],
      "ipAddresses": ["192.0.2.1"],
      "observations": [
        {
          "source": "snmp",
          "observedAt": "2026-10-13T09:00:05Z",
          "ipAddress": "192.0.2.1",
          "macAddress": "02:10:00:00:00:01",
          "fields": {
            "name": "Core Controller",
            "vendor": "Acme Controls",
            "model": "AC-1000",
            "serialNumber": "SNMP-ROOT",
            "ipAddress": "192.0.2.1",
            "status": "online"
          },
          "raw": {
            "observationId": "59b1ea4f-2a9b-4dc0-9044-2c09cbe30b44",
            "subject": { "kind": "device", "macAddress": "02:10:00:00:00:01" },
            "identityComponentRef": "entity:1",
            "serialClaim": {
              "scope": "chassis",
              "componentRef": "entity:1",
              "issuer": "Acme Controls",
              "original": "SNMP-ROOT",
              "encoding": "snmp-display-string",
              "normalizationVersion": 1
            },
            "physicalEntities": [
              {
                "ref": "entity:1",
                "entPhysicalIndex": "1",
                "parentRef": null,
                "parentPosition": 0,
                "class": "chassis",
                "manufacturer": "Acme Controls",
                "name": "AC-1000",
                "serialClaim": {
                  "scope": "chassis",
                  "componentRef": "entity:1",
                  "issuer": "Acme Controls",
                  "original": "SNMP-ROOT",
                  "encoding": "snmp-display-string",
                  "normalizationVersion": 1
                }
              },
              {
                "ref": "entity:2",
                "entPhysicalIndex": "2",
                "parentRef": "entity:1",
                "parentPosition": 1,
                "class": "module",
                "manufacturer": "Acme Controls",
                "name": "I/O Module",
                "serialClaim": {
                  "scope": "module",
                  "componentRef": "entity:2",
                  "issuer": "Acme Controls",
                  "original": "SNMP-MODULE",
                  "encoding": "snmp-display-string",
                  "normalizationVersion": 1
                }
              }
            ],
            "1.3.6.1.2.1.47.1.1.1.1.4.1": 0,
            "1.3.6.1.2.1.47.1.1.1.1.5.1": 3,
            "1.3.6.1.2.1.47.1.1.1.1.11.1": "SNMP-ROOT",
            "1.3.6.1.2.1.47.1.1.1.1.12.1": "Acme Controls",
            "1.3.6.1.2.1.47.1.1.1.1.13.1": "AC-1000",
            "1.3.6.1.2.1.47.1.1.1.1.4.2": 1,
            "1.3.6.1.2.1.47.1.1.1.1.5.2": 9,
            "1.3.6.1.2.1.47.1.1.1.1.11.2": "SNMP-MODULE",
            "1.3.6.1.2.1.47.1.1.1.1.12.2": "Acme Controls",
            "1.3.6.1.2.1.47.1.1.1.1.13.2": "I/O Module"
          },
          "warnings": []
        },
        {
          "source": "profinet-dcp",
          "observedAt": "2026-10-13T09:00:06Z",
          "ipAddress": "192.0.2.1",
          "macAddress": "02:10:00:00:00:01",
          "fields": {
            "manufacturer": "Acme Controls",
            "serialNumber": "PNIO-SUBMODULE",
            "softwareRevision": "1.2.3"
          },
          "raw": {
            "observationId": "a5b87508-a6ca-4da6-893a-8b22be2d5bc4",
            "subject": { "kind": "device", "macAddress": "02:10:00:00:00:01" },
            "physicalEntities": [
              {
                "ref": "pnio:7:3:1",
                "parentRef": "pnio:7:3",
                "parentPosition": 1,
                "class": "submodule",
                "serialClaim": {
                  "scope": "submodule",
                  "componentRef": "pnio:7:3:1",
                  "issuer": "Acme Controls",
                  "original": "PNIO-SUBMODULE",
                  "encoding": "profinet-im-text",
                  "normalizationVersion": 1
                }
              }
            ],
            "pnioRecords": [
              {
                "api": 7,
                "slot": 3,
                "subslot": 1,
                "index": "0xAFF0",
                "parsed": {
                  "manufacturerId": "1234",
                  "manufacturerName": "Acme Controls",
                  "serialNumber": "PNIO-SUBMODULE"
                },
                "raw": "01020304"
              }
            ]
          },
          "warnings": []
        }
      ],
      "interfaces": [
        {
          "key": "ifIndex:1",
          "source": "snmp",
          "name": "lan0",
          "description": "Control network",
          "macAddress": "02:10:00:00:00:01",
          "ipAddresses": ["192.0.2.1"],
          "raw": {}
        }
      ],
      "ports": [
        {
          "key": "ifIndex:1",
          "source": "snmp",
          "interfaceKey": "ifIndex:1",
          "portId": "lan0",
          "vlans": [100],
          "raw": {}
        }
      ]
    },
    {
      "macAddress": "02:10:00:00:00:02",
      "macAddresses": ["02:10:00:00:00:02"],
      "ipAddresses": ["192.0.2.2"],
      "observations": [
        {
          "source": "arp",
          "observedAt": "2026-10-13T09:00:07Z",
          "ipAddress": "192.0.2.2",
          "macAddress": "02:10:00:00:00:02",
          "fields": { "name": "Remote I/O", "status": "online" },
          "raw": {},
          "warnings": []
        }
      ],
      "interfaces": [],
      "ports": []
    }
  ],
  "links": [
    {
      "source": "lldp",
      "observedAt": "2026-10-13T09:00:08Z",
      "local": {
        "macAddress": "02:10:00:00:00:01",
        "interfaceKey": "ifIndex:1",
        "portId": "lan0"
      },
      "remote": { "macAddress": "02:10:00:00:00:02", "portId": "port-1" },
      "raw": { "protocol": "lldp" }
    }
  ],
  "unresolved": [
    {
      "source": "snmp",
      "observedAt": "2026-10-13T09:00:09Z",
      "ipAddress": "198.51.100.10",
      "fields": { "ipAddress": "198.51.100.10" },
      "raw": {
        "observationId": "540a0ded-69f2-4780-af19-a0e271cf367d",
        "subject": { "kind": "endpoint", "ipAddress": "198.51.100.10" }
      },
      "warnings": []
    }
  ],
  "warnings": [],
  "errors": []
}
